{
  "atlas_id": "A004-shear-automorphism",
  "version": "0.1.0",
  "mu_generic_degree": 1,
  "mu_evidence": "unknown",
  "ambient_dimension": 3,
  "map": {
    "name": "F_linear_shear",
    "variables": ["x0", "x1", "x2"],
    "formula_display": {
      "F0": "x0",
      "F1": "x1 + x0",
      "F2": "x2"
    },
    "construction": "Linear shear automorphism F(q)=Aq with det A=1. Dual fields constant (columns of A^{-1}). Complete. B-incomplete pass; B-CCR pass at linear Bogoliubov level. Baseline positive row for Program B.",
    "anchor_ref": ""
  },
  "jacobian": {
    "det_constant": "1",
    "det_status": "certified"
  },
  "collision": {
    "retained_seed_triple": false,
    "target": ["0", "0", "0"],
    "inputs": [["0", "0", "0"]],
    "status": "unknown"
  },
  "placeholders": {
    "poisson_lift_Phi": "linear symplectic cotangent lift",
    "weyl_formula": "linear Bogoliubov on Weyl algebra",
    "star_domain_status": "ESS standard on R^3"
  },
  "evidence_level": "A_algebra_pilot",
  "certificates": {
    "dossiers": ["docs/notes/COMPANION-PACK.md"],
    "cas_reports": [],
    "literature": []
  },
  "composition_notes": "Automorphism baseline for B schema; contrasts A001/A003 fail rows.",
  "non_claims": [
    "Not exotic",
    "Not a Keller counterexample",
    "No gates/channels"
  ],
  "status": "active",
  "program_b": {
    "b_incomplete": "pass",
    "b_ess": "pass",
    "b_def": "(0,0) expected",
    "b_ccr": "pass",
    "b_cp": "pass",
    "evidence": [
      "F linear automorphism det=1; dual fields constant complete",
      "linear symplectic ⇒ Bogoliubov implementable in principle"
    ]
  }
}
