{
  "atlas_id": "A002-family-d4-pilot",
  "version": "1.0.0",
  "mu_generic_degree": 4,
  "mu_evidence": "fiber_poly_degree",
  "ambient_dimension": 3,
  "map": {
    "name": "F_family_d4_cor53_pilot",
    "variables": [
      "x0",
      "x1",
      "x2"
    ],
    "formula_display": {
      "P": "A*B with A=1+xy, B=A^2 z + y^2(4+3xy)",
      "Q_psi": "Q + A^2 * x^2 * B^4 * psi_2(P)",
      "R_psi": "R - (1/2) * x^4 * B^4 * psi_2(P)",
      "psi_2": "c*(4*T+1) with c=1",
      "note": "Q,R are seed components; full expanded sparse form not required for row identity"
    },
    "construction": "Ulam Cor 5.3 recipe for d=4: N=2, psi_2(T)=c(4T+1), other psi_j=0; F_psi=(P,Q_psi,R_psi) on seed (P,Q,R).",
    "anchor_ref": "data/anchor/F_family_d4_cor53_pilot.json"
  },
  "jacobian": {
    "det_constant": "-2",
    "det_status": "certified_pilot"
  },
  "collision": {
    "retained_seed_triple": true,
    "target": [
      "-1/4",
      "0",
      "0"
    ],
    "inputs": [
      [
        "0",
        "0",
        "-1/4"
      ],
      [
        "1",
        "-3/2",
        "13/2"
      ],
      [
        "-1",
        "3/2",
        "13/2"
      ]
    ],
    "status": "certified_pilot"
  },
  "geometry_placeholders": {
    "discriminant_nonproper_set": "pending family geometry",
    "omitted_set": "pending family geometry",
    "monodromy_galois": "pending",
    "primitive_decomposition": "seed + Thm 5.2 psi deformation (j=2)",
    "real_locus": "pending"
  },
  "placeholders": {
    "poisson_lift_Phi": "G2 TODO: Phi_4(q,p)=(F_psi(q), J^{-T} p); not proved in this row",
    "weyl_formula": "G3 TODO: Weyl lift of F_psi; not proved in this row",
    "star_domain_status": "G4 TODO: not started"
  },
  "evidence_level": "A_algebra_pilot",
  "certificates": {
    "dossiers": [
      "docs/validation/D0-family-pilot-dossier.md",
      "docs/literature/family-theorem-extract.md"
    ],
    "cas_reports": [
      "data/anchor/cas_family_d4_sympy_report.json",
      "data/anchor/cas_family_d4_purepython_report.json"
    ],
    "lean": {
      "repo": "https://github.com/Quantyra/exotic-ccr-lean",
      "release": "v0.1.1",
      "theorems": [],
      "status": "plan_only_see_docs/validation/lean-plan-family-d4.md"
    },
    "literature": [
      "docs/literature/jacobian-counterexample-ulam-2026-07-20.pdf",
      "docs/literature/family-theorem-extract.md"
    ]
  },
  "composition_notes": "Instance of Cor 5.3 family at d=4. Not a composite of atlas rows. Further d via same recipe not bulk-registered.",
  "non_claims": [
    "Pilot algebraic certification only \u2014 not full independent re-proof of Thm 5.2 for arbitrary psi",
    "mu=4 justified at fiber-polynomial degree + preprint; not full function-field re-proof in CAS",
    "Does not claim forall d machine certification",
    "Does not claim factory-false slogan as Quantyra theorem",
    "Does not claim Poisson/Weyl/physical/channel/gate/advantage results"
  ],
  "status": "active",
  "program_b": {
    "b_incomplete": "open",
    "b_ess": "open",
    "b_def": "open",
    "b_ccr": "open",
    "b_cp": "open",
    "evidence": [
      "docs/validation/PROGRAM-B-B1-structural-lemma.md",
      "docs/validation/ATLAS-ESS-SPOTCHECK-A001-A002.md",
      "note: real non-surjectivity pending; B1 applies if dual fields+non-surjective"
    ]
  }
}
